<?xml version='1.0'?>
<!DOCTYPE BI SYSTEM "bilhete_de_identidade.dtd">

<BI>
	<NUMERO-BI>
		<NUMERO>10033445</NUMERO>
		<DIGITO-CONTROLO>3</DIGITO-CONTROLO>
	</NUMERO-BI>
	
	<EMISSAO>
		<DATA>22/09/2003</DATA>
		<LOCAL>Lisboa</LOCAL>
	</EMISSAO>
	<NOME>Carlos Jose Corredoura Serrao</NOME>
	<FILIACAO>
		<PAI>Carlos Manuel Serrao</PAI>
		<MAE>Maria Norlinda dos Santos Corredoura Serrao</MAE>
	</FILIACAO>
	<NATURALIDADE>
		<FREGUESIA>S. Sebastiao da Pedreira</FREGUESIA>
		<CONCELHO>Lisboa</CONCELHO>
	</NATURALIDADE>
	<RESIDENCIA>
		<FREGUESIA>Feijo</FREGUESIA>
		<CONCELHO>Almada</CONCELHO>
	</RESIDENCIA>
	<DATA-DE-NASCIMENTO>06/01/1973</DATA-DE-NASCIMENTO>
	<ESTADO-CIVIL>Casado</ESTADO-CIVIL>
	<ALTURA>1,78</ALTURA>
	<VALIDADE>05/05/2009</VALIDADE>
	<NUMERO-BI>
		<NUMERO>123456</NUMERO>
		<DIGITO-CONTROLO>9</DIGITO-CONTROLO>
	</NUMERO-BI>
	
	<EMISSAO>
		<DATA>22/09/2004</DATA>
		<LOCAL>Lisboa</LOCAL>
	</EMISSAO>
	<NOME>Joaquim Marques</NOME>
	<FILIACAO>
		<PAI>Jose Marques</PAI>
		<MAE>Celeste marques</MAE>
	</FILIACAO>
	<NATURALIDADE>
		<FREGUESIA>Povoa de Varzim</FREGUESIA>
		<CONCELHO>Povoa de Varzim </CONCELHO>
	</NATURALIDADE>
	<RESIDENCIA>
		<FREGUESIA>C.Branco</FREGUESIA>
		<CONCELHO>C.Branco</CONCELHO>
	</RESIDENCIA>
	<DATA-DE-NASCIMENTO>01/01/1961</DATA-DE-NASCIMENTO>
	<ESTADO-CIVIL>Casado</ESTADO-CIVIL>
	<ALTURA>1,75</ALTURA>
	<VALIDADE>05/10/2011</VALIDADE>
</BI>

